{
  "schema_version": "animation-compiled-manifest-1.0",
  "animation_id": "attack-front-v2",
  "spec_path": "profiles/animation/attack-front-v2.json",
  "spec_sha256": "d8ca4db66752949ba50a3bfd688d014eb370d863e1b199c9458f8c8ecd4c4904",
  "source": {
    "asset_revision_id": "r4-cutout-rig-v071",
    "direction": "front",
    "source_sha256": "7c2d0ea531de5996bd747971c9daedef60a5ca9f2e5b57b2a52f80c05f8f5798",
    "source_rig_ref": "docs/evidence/r4-cutout-rig-v071.json"
  },
  "frames": [
    {
      "index": 0,
      "phase": "V0-ready",
      "path": "docs/evidence/animation-runtime-v0111/attack-front-v2/frame-00.png",
      "rgba_sha256": "ac5e8c5867399a5d10e03b6066cfdd0867320bfa5b1598568cba09b7ba1dfd05",
      "target_hash": "ab4b5cbb734e784e3d6f4f3e5fc67c46e9c1bdcc6973716624c61b36e721963f",
      "metadata": {
        "phase": "V0-ready",
        "target_hash": "ab4b5cbb734e784e3d6f4f3e5fc67c46e9c1bdcc6973716624c61b36e721963f",
        "presentation_target_hash": "afa49ee55cca061fc1536436b50efcb5492b94198c21b863f52d79d826cdcaf4",
        "z_order": [
          "right_shin_foot",
          "right_thigh",
          "left_forearm_hand",
          "left_upper_arm",
          "torso_pelvis",
          "left_thigh",
          "left_shin_foot",
          "right_upper_arm",
          "right_forearm_hand",
          "head",
          "sword"
        ],
        "target": {
          "joints": {
            "shoulder_left": {
              "x": 314.2688,
              "y": 126.481
            },
            "shoulder_right": {
              "x": 219.7551,
              "y": 126.12
            },
            "elbow_left": {
              "x": 332.4109,
              "y": 193.1442
            },
            "elbow_right": {
              "x": 203.5855,
              "y": 192.0721
            },
            "wrist_left": {
              "x": 348.8077,
              "y": 258.5055
            },
            "wrist_right": {
              "x": 195.0874,
              "y": 257.3811
            },
            "hip_left": {
              "x": 296.1561,
              "y": 252.2711
            },
            "hip_right": {
              "x": 242.9306,
              "y": 253.2929
            },
            "knee_left": {
              "x": 304.6358,
              "y": 352.4924
            },
            "knee_right": {
              "x": 236.19,
              "y": 350.9961
            },
            "ankle_left": {
              "x": 309.4539,
              "y": 448.5532
            },
            "ankle_right": {
              "x": 234.1367,
              "y": 447.4095
            },
            "nose": {
              "x": 269.8312,
              "y": 78.8774
            },
            "neck": {
              "x": 267.012,
              "y": 111.1197
            },
            "pelvis": {
              "x": 269.54335,
              "y": 252.782
            },
            "shoulder_center": {
              "x": 267.01195,
              "y": 126.3005
            },
            "weapon_tip": {
              "x": 160.0,
              "y": 459.0
            }
          },
          "phase": "V0-ready",
          "view": "front",
          "orientation": "front",
          "generator": {
            "kind": "deterministic-skeleton-only-motion-quality-layer",
            "parameters_frozen_before_render": true,
            "pixel_interpolation": false
          },
          "frame_index": 0,
          "motion_tracks_sample": {
            "root_shift_x": 0.0,
            "root_shift_y": 0.0,
            "torso_rotation_deg": 0.0,
            "torso_lean_x": 0.0,
            "right_upper_arm_rotation_deg": 0.0,
            "right_forearm_rotation_deg": 0.0,
            "right_wrist/grip_rotation_deg": 0.0,
            "sword_rotation_deg": 0.0,
            "left_upper_arm_counter_deg": 0.0,
            "left_forearm_counter_deg": 0.0,
            "head_counter_rotation_deg": 0.0
          },
          "target_joint_sha256": "ab4b5cbb734e784e3d6f4f3e5fc67c46e9c1bdcc6973716624c61b36e721963f"
        },
        "sword_target_pivot": [
          195.0874,
          257.3811
        ],
        "motion_tracks_sample": {
          "root_shift_x": 0.0,
          "root_shift_y": 0.0,
          "torso_rotation_deg": 0.0,
          "torso_lean_x": 0.0,
          "right_upper_arm_rotation_deg": 0.0,
          "right_forearm_rotation_deg": 0.0,
          "right_wrist/grip_rotation_deg": 0.0,
          "sword_rotation_deg": 0.0,
          "left_upper_arm_counter_deg": 0.0,
          "left_forearm_counter_deg": 0.0,
          "head_counter_rotation_deg": 0.0
        }
      }
    },
    {
      "index": 1,
      "phase": "V1-anticipation-early",
      "path": "docs/evidence/animation-runtime-v0111/attack-front-v2/frame-01.png",
      "rgba_sha256": "74d2bc2c1110232d1fc5ddf675d081277c9b381970edcee189e53719038c5203",
      "target_hash": "2d10a47ab138f986fe5340a5575999b8e48ca8b1fe67cc67f7d315cd667b0833",
      "metadata": {
        "phase": "V1-anticipation-early",
        "target_hash": "2d10a47ab138f986fe5340a5575999b8e48ca8b1fe67cc67f7d315cd667b0833",
        "presentation_target_hash": "f15bf06de38c9eb81b921df1f25893545622ddf7578831f226883b1971d7e902",
        "z_order": [
          "right_shin_foot",
          "right_thigh",
          "left_forearm_hand",
          "left_upper_arm",
          "torso_pelvis",
          "left_thigh",
          "left_shin_foot",
          "right_upper_arm",
          "right_forearm_hand",
          "head",
          "sword"
        ],
        "target": {
          "joints": {
            "shoulder_left": {
              "x": 312.669013,
              "y": 125.79572
            },
            "shoulder_right": {
              "x": 218.158827,
              "y": 126.687171
            },
            "elbow_left": {
              "x": 331.392161,
              "y": 192.298064
            },
            "elbow_right": {
              "x": 203.249754,
              "y": 192.935605
            },
            "wrist_left": {
              "x": 348.800965,
              "y": 257.397128
            },
            "wrist_right": {
              "x": 193.423674,
              "y": 258.058038
            },
            "hip_left": {
              "x": 296.224771,
              "y": 251.814791
            },
            "hip_right": {
              "x": 243.017484,
              "y": 253.541802
            },
            "knee_left": {
              "x": 304.718763,
              "y": 352.450919
            },
            "knee_right": {
              "x": 236.272963,
              "y": 350.954619
            },
            "ankle_left": {
              "x": 309.4539,
              "y": 448.5532
            },
            "ankle_right": {
              "x": 234.1367,
              "y": 447.4095
            },
            "nose": {
              "x": 269.083191,
              "y": 78.780615
            },
            "neck": {
              "x": 266.357688,
              "y": 111.03097
            },
            "pelvis": {
              "x": 269.621128,
              "y": 252.678296
            },
            "shoulder_center": {
              "x": 265.41392,
              "y": 126.241445
            },
            "weapon_tip": {
              "x": 150.48014,
              "y": 458.150915
            }
          },
          "phase": "V1-anticipation-early",
          "view": "front",
          "orientation": "front",
          "generator": {
            "kind": "deterministic-skeleton-only-motion-quality-layer",
            "parameters_frozen_before_render": true,
            "pixel_interpolation": false
          },
          "frame_index": 1,
          "motion_tracks_sample": {
            "root_shift_x": 0.2074074074074074,
            "root_shift_y": -0.1037037037037037,
            "torso_rotation_deg": -0.7592592592592592,
            "torso_lean_x": -0.12962962962962962,
            "right_upper_arm_rotation_deg": -0.3333333333333333,
            "right_forearm_rotation_deg": 1.9259259259259256,
            "right_wrist/grip_rotation_deg": 0.3333333333333333,
            "sword_rotation_deg": 2.6666666666666665,
            "left_upper_arm_counter_deg": 0.25925925925925924,
            "left_forearm_counter_deg": -0.12962962962962962,
            "head_counter_rotation_deg": 0.12962962962962962
          },
          "target_joint_sha256": "2d10a47ab138f986fe5340a5575999b8e48ca8b1fe67cc67f7d315cd667b0833"
        },
        "sword_target_pivot": [
          193.423674,
          258.058038
        ],
        "motion_tracks_sample": {
          "root_shift_x": 0.2074074074074074,
          "root_shift_y": -0.1037037037037037,
          "torso_rotation_deg": -0.7592592592592592,
          "torso_lean_x": -0.12962962962962962,
          "right_upper_arm_rotation_deg": -0.3333333333333333,
          "right_forearm_rotation_deg": 1.9259259259259256,
          "right_wrist/grip_rotation_deg": 0.3333333333333333,
          "sword_rotation_deg": 2.6666666666666665,
          "left_upper_arm_counter_deg": 0.25925925925925924,
          "left_forearm_counter_deg": -0.12962962962962962,
          "head_counter_rotation_deg": 0.12962962962962962
        }
      }
    },
    {
      "index": 2,
      "phase": "V2-anticipation",
      "path": "docs/evidence/animation-runtime-v0111/attack-front-v2/frame-02.png",
      "rgba_sha256": "a17e938c822f856a3f4a64918aa4617b60bb292c680cb651cbde5b5e3300c6df",
      "target_hash": "845dabf6a7e6370c75009df391d128c805d2f3f3e4bf64590bf54fc92b42482f",
      "metadata": {
        "phase": "V2-anticipation",
        "target_hash": "845dabf6a7e6370c75009df391d128c805d2f3f3e4bf64590bf54fc92b42482f",
        "presentation_target_hash": "0ae7b58eee3e1cd03660c6b4a0c97af948799fb43cc00acf381c5896d493213e",
        "z_order": [
          "right_shin_foot",
          "right_thigh",
          "left_forearm_hand",
          "left_upper_arm",
          "torso_pelvis",
          "left_thigh",